{"$schema":"https://json-schema.org/draft/2020-12/schema","$id":"https://spirosearch.local/schemas/project-run-index.schema.json","title":"project-run-index","type":"object","additionalProperties":false,"required":["schema_version","project_id","comparison_policy_version","generated_at","runs","comparisons"],"properties":{"schema_version":{"const":"v20.project_run_index.v1"},"project_id":{"type":"string","minLength":1},"comparison_policy_version":{"type":"string","minLength":1},"generated_at":{"type":"string","minLength":1},"runs":{"type":"array","minItems":1,"items":{"$schema":"https://json-schema.org/draft/2020-12/schema","$id":"https://spirosearch.local/schemas/ProjectRunIndexEntry.schema.json","title":"ProjectRunIndexEntry","type":"object","additionalProperties":false,"required":["project_id","run_id","manifest_path","manifest_sha256","predecessor_run_id","generated_at","candidate_count","comparison_dimensions","validation"],"properties":{"project_id":{"type":"string","minLength":1},"run_id":{"type":"string","minLength":1},"manifest_path":{"type":"string","minLength":1},"manifest_sha256":{"type":"string","pattern":"^[0-9a-f]{64}$"},"predecessor_run_id":{"type":["string","null"]},"generated_at":{"type":"string","minLength":1},"candidate_count":{"type":"integer","minimum":0},"comparison_dimensions":{"type":"object","additionalProperties":{"type":["string","number","boolean","null"]}},"validation":{"$schema":"https://json-schema.org/draft/2020-12/schema","$id":"https://spirosearch.local/schemas/ProjectRunValidation.schema.json","title":"ProjectRunValidation","type":"object","additionalProperties":false,"required":["status","reason_codes"],"properties":{"status":{"enum":["valid","degraded","invalid","unavailable"]},"reason_codes":{"type":"array","items":{"type":"string"},"uniqueItems":true}}}}}},"comparisons":{"type":"array","items":{"$schema":"https://json-schema.org/draft/2020-12/schema","$id":"https://spirosearch.local/schemas/ProjectRunComparison.schema.json","title":"ProjectRunComparison","type":"object","additionalProperties":false,"required":["source_run_id","target_run_id","compatibility_path","compatibility_sha256","delta_path","delta_sha256","delta_bytes","schema_ref","comparison_policy_version"],"properties":{"source_run_id":{"type":"string","minLength":1},"target_run_id":{"type":"string","minLength":1},"compatibility_path":{"type":"string","minLength":1},"compatibility_sha256":{"type":"string","pattern":"^[0-9a-f]{64}$"},"delta_path":{"type":"string","minLength":1},"delta_sha256":{"type":"string","pattern":"^[0-9a-f]{64}$"},"delta_bytes":{"type":"integer","minimum":0},"schema_ref":{"const":"schemas/run-delta.schema.json"},"comparison_policy_version":{"type":"string","minLength":1}}}}}}
