{"schema_version":"v20.project_run_index.v1","project_id":"project-v20-fixture","comparison_policy_version":"v20.run_compatibility_policy.v1","generated_at":"2026-07-15T00:00:00Z","runs":[{"project_id":"project-v20-fixture","run_id":"run-001","manifest_path":"run-001/run-manifest.json","manifest_sha256":"9953f8679e9a5393428274ccaea0d2afb0a30cac57e25c48e7eebf6b1c37ef08","predecessor_run_id":null,"generated_at":"2026-07-15T00:00:00Z","candidate_count":2,"comparison_dimensions":{"dataset_snapshot_id":"snapshot-a","screening_profile_version":"v12.htl_screening.v1","scoring_formula_version":"formula-a"},"validation":{"status":"valid","reason_codes":[]}},{"project_id":"project-v20-fixture","run_id":"run-002","manifest_path":"run-002/run-manifest.json","manifest_sha256":"8f7fb8e599290838a7bfef4faa29efe2fa23a793cadafd5925f470e05a38125e","predecessor_run_id":"run-001","generated_at":"2026-07-15T00:00:00Z","candidate_count":2,"comparison_dimensions":{"dataset_snapshot_id":"snapshot-b","screening_profile_version":"v12.htl_screening.v1","scoring_formula_version":"formula-a"},"validation":{"status":"valid","reason_codes":[]}}],"comparisons":[{"source_run_id":"run-001","target_run_id":"run-002","compatibility_path":"run-compatibility.run-001.run-002.json","compatibility_sha256":"2edc1fe388625e5ab62c13172c91d8918452f951420f9bfee28ce25e9870c832","delta_path":"run-delta.run-001.run-002.json","delta_sha256":"986c8856a7eb8e452e6265d2db924cf88e98f70acc313e67d33978b77d98940c","delta_bytes":2209,"schema_ref":"schemas/run-delta.schema.json","comparison_policy_version":"v20.run_compatibility_policy.v1"}]}
